{
 "contrato": "benchmark.catalogo-estilos/v1",
 "gerado_em": "2026-08-12T09:53:04-03:00",
 "gerador": "scripts/gerar-previews.py",
 "canvas": {
  "largura": 1080,
  "altura": 1920,
  "fps": 30,
  "escala": 0.3333
 },
 "estilos": [
  {
   "slug": "plano-fixo",
   "grupo": "gramatica",
   "nome": "Plano fixo",
   "oQuePinta": "Um enquadramento só do começo ao fim; o corte de fala aparece como jump cut assumido.",
   "camada": "edl",
   "estado": "pronto",
   "perfis": [
    "reels",
    "vsl",
    "screencast",
    "longform"
   ],
   "defaultDe": [
    "reels",
    "longform"
   ],
   "origem": "skills/edit-video/perfis/reels.json:ritmo.gramatica_plano",
   "parametros": [
    {
     "nome": "zoom",
     "tipo": "fator",
     "padrao": 1,
     "faixa": [
      1,
      1.6
     ],
     "nota": "recorte único aplicado a todos os segmentos da EDL"
    }
   ],
   "duplicatas": [],
   "preview": {
    "durS": 3,
    "placa": "retrato",
    "frameCartao": 54,
    "w": 360,
    "h": 640,
    "fps": 30,
    "webm": "previews/plano-fixo.webm",
    "poster": "previews/plano-fixo.png"
   },
   "desde": "2026-08-08",
   "sha": "09d9ae5bbee0"
  },
  {
   "slug": "plano-alternado",
   "grupo": "gramatica",
   "nome": "Plano alternado",
   "oQuePinta": "Alterna enquadramento nativo e punch-in a cada frase, e o jump cut passa a ler como troca de plano.",
   "camada": "edl",
   "estado": "pronto",
   "perfis": [
    "reels",
    "vsl",
    "longform"
   ],
   "defaultDe": [],
   "origem": "skills/edit-video/perfis/_base.json:ritmo.zoom_alternado",
   "parametros": [
    {
     "nome": "zoomA",
     "tipo": "fator",
     "padrao": 1,
     "faixa": [
      1,
      1.2
     ]
    },
    {
     "nome": "zoomB",
     "tipo": "fator",
     "padrao": 1.27,
     "faixa": [
      1.1,
      1.6
     ],
     "nota": "faixa medida na referência: 1,22–1,31"
    },
    {
     "nome": "trocaS",
     "tipo": "s",
     "padrao": 2.2,
     "faixa": [
      0.8,
      8
     ],
     "nota": "na peça real a troca é por FRASE; no preview é periódica"
    }
   ],
   "medido": {
    "fonte": "ref-D, take único 4K, 23 s (modelado 2026-07-25)",
    "data": "2026-07-25"
   },
   "duplicatas": [],
   "preview": {
    "durS": 4.6,
    "placa": "retrato",
    "frameCartao": 96,
    "w": 360,
    "h": 640,
    "fps": 30,
    "webm": "previews/plano-alternado.webm",
    "poster": "previews/plano-alternado.png"
   },
   "desde": "2026-08-08",
   "sha": "e959703a9f9e"
  },
  {
   "slug": "punch-pontual",
   "grupo": "gramatica",
   "nome": "Punch-in pontual",
   "oQuePinta": "Um único avanço de enquadramento num beat de ênfase; o resto da peça fica no plano nativo.",
   "camada": "edl",
   "estado": "pronto",
   "perfis": [
    "reels",
    "vsl",
    "screencast",
    "longform"
   ],
   "defaultDe": [
    "vsl",
    "screencast"
   ],
   "origem": "skills/edit-video/perfis/vsl.json:ritmo.gramatica_plano",
   "parametros": [
    {
     "nome": "zoom",
     "tipo": "fator",
     "padrao": 1.27,
     "faixa": [
      1.05,
      1.6
     ]
    },
    {
     "nome": "emS",
     "tipo": "s",
     "padrao": 1.2,
     "faixa": [
      0,
      60
     ]
    },
    {
     "nome": "rampaS",
     "tipo": "s",
     "padrao": 0.45,
     "faixa": [
      0.1,
      2
     ]
    }
   ],
   "duplicatas": [],
   "preview": {
    "durS": 3,
    "placa": "retrato",
    "frameCartao": 54,
    "w": 360,
    "h": 640,
    "fps": 30,
    "webm": "previews/punch-pontual.webm",
    "poster": "previews/punch-pontual.png"
   },
   "desde": "2026-08-08",
   "sha": "ac99998cddf2"
  },
  {
   "slug": "split-screen-esfumacado",
   "grupo": "gramatica",
   "nome": "Split-screen esfumaçado",
   "oQuePinta": "Encaixa o apoio no topo, REENQUADRA a base para o rosto cair abaixo da rampa e dissolve a emenda numa rampa longa de alpha. O deslocamento é MEDIDO por segmento do vídeo, não escolhido no olho.",
   "camada": "pixel",
   "estado": "pronto",
   "perfis": [
    "reels",
    "vsl",
    "longform"
   ],
   "defaultDe": [],
   "origem": "skills/edit-video/scripts/split-broll.py:56",
   "parametros": [
    {
     "nome": "opacoPct",
     "tipo": "fator",
     "padrao": 34,
     "faixa": [
      20,
      45
     ],
     "nota": "fração da altura"
    },
    {
     "nome": "fimPct",
     "tipo": "fator",
     "padrao": 51,
     "faixa": [
      30,
      60
     ],
     "nota": "% onde o alpha chega a zero — a diferença para `opacoPct` É a rampa"
    },
    {
     "nome": "folgaTopoPct",
     "tipo": "fator",
     "padrao": 3.6,
     "faixa": [
      1,
      8
     ],
     "nota": "respiro entre o fim da rampa e o topo da cabeça; o deslocamento é MEDIDO, não escolhido"
    },
    {
     "nome": "escalaMax",
     "tipo": "fator",
     "padrao": 1.08,
     "faixa": [
      1,
      1.25
     ],
     "nota": "teto do upscale da base; estourar é exit 1, nunca clamp silencioso"
    }
   ],
   "medido": {
    "fonte": "ref-D — rampa longa (17% da altura) no trecho remendado; enquadramento medido por matte de pessoa em 35 amostras (SPEC-28): sem plano, 12,2% de mediana de b-roll sobre o topo da cabeça; com plano, 0,00%",
    "data": "2026-08-09"
   },
   "duplicatas": [],
   "preview": {
    "durS": 3,
    "placa": "retrato",
    "frameCartao": 54,
    "w": 360,
    "h": 640,
    "fps": 30,
    "webm": "previews/split-screen-esfumacado.webm",
    "poster": "previews/split-screen-esfumacado.png"
   },
   "desde": "2026-08-08",
   "sha": "9855d27d9c40"
  },
  {
   "slug": "hook-titulo-typeon",
   "grupo": "gancho",
   "nome": "Gancho digitado",
   "oQuePinta": "Uma linha em caixa alta condensada digita letra a letra e uma serif itálica entra seca embaixo, deslocada.",
   "camada": "alpha",
   "estado": "pronto",
   "perfis": [
    "reels",
    "vsl",
    "screencast",
    "longform"
   ],
   "defaultDe": [
    "reels"
   ],
   "origem": "src/TitleCard.tsx:82",
   "parametros": [
    {
     "nome": "fpc",
     "tipo": "fator",
     "padrao": 1.1,
     "faixa": [
      0.4,
      3
     ],
     "nota": "frames por caractere digitado"
    },
    {
     "nome": "fontSize1",
     "tipo": "px",
     "padrao": 128,
     "faixa": [
      48,
      220
     ]
    },
    {
     "nome": "fontSize2",
     "tipo": "px",
     "padrao": 150,
     "faixa": [
      48,
      240
     ]
    },
    {
     "nome": "gap2",
     "tipo": "px",
     "padrao": -34,
     "faixa": [
      -140,
      140
     ]
    },
    {
     "nome": "align2",
     "tipo": "enum",
     "padrao": "right",
     "valores": [
      "center",
      "right",
      "left"
     ],
     "nota": "o degrau assimétrico é o que dá o ar de assinatura"
    },
    {
     "nome": "inset2",
     "tipo": "px",
     "padrao": 140,
     "faixa": [
      0,
      400
     ]
    },
    {
     "nome": "ajustar",
     "tipo": "bool",
     "padrao": false,
     "nota": "SPEC-13: liga o ajuste por largura medida; exige fonte já carregada"
    }
   ],
   "medido": {
    "fonte": "ref-D — abertura tipográfica dos 2 primeiros segundos",
    "data": "2026-07-25"
   },
   "duplicatas": [],
   "preview": {
    "durS": 3,
    "placa": "retrato",
    "frameCartao": 66,
    "w": 360,
    "h": 640,
    "fps": 30,
    "webm": "previews/hook-titulo-typeon.webm",
    "poster": "previews/hook-titulo-typeon.png"
   },
   "desde": "2026-08-08",
   "sha": "f6dbdb91eff7"
  },
  {
   "slug": "hook-titulo-fade",
   "grupo": "gancho",
   "nome": "Gancho digitado com saída em fade",
   "oQuePinta": "O mesmo gancho digitado, mas com um instante declarado em que ele sai de cena por fade.",
   "camada": "alpha",
   "estado": "pronto",
   "perfis": [
    "reels",
    "vsl",
    "screencast",
    "longform"
   ],
   "defaultDe": [],
   "origem": "src/TitleCard.tsx:216",
   "parametros": [
    {
     "nome": "fadeAtS",
     "tipo": "s",
     "padrao": 2.2,
     "faixa": [
      0.5,
      12
     ]
    },
    {
     "nome": "fpc",
     "tipo": "fator",
     "padrao": 1.1,
     "faixa": [
      0.4,
      3
     ]
    },
    {
     "nome": "fontSize1",
     "tipo": "px",
     "padrao": 128,
     "faixa": [
      48,
      220
     ]
    },
    {
     "nome": "fontSize2",
     "tipo": "px",
     "padrao": 150,
     "faixa": [
      48,
      240
     ]
    },
    {
     "nome": "align2",
     "tipo": "enum",
     "padrao": "right",
     "valores": [
      "center",
      "right",
      "left"
     ]
    }
   ],
   "medido": {
    "fonte": "ref-D — mesma abertura, com a saída declarada",
    "data": "2026-07-25"
   },
   "duplicatas": [],
   "preview": {
    "durS": 3,
    "placa": "retrato",
    "frameCartao": 54,
    "w": 360,
    "h": 640,
    "fps": 30,
    "webm": "previews/hook-titulo-fade.webm",
    "poster": "previews/hook-titulo-fade.png"
   },
   "desde": "2026-08-08",
   "sha": "fc3d85b052f6"
  },
  {
   "slug": "hook-lettering-anotado",
   "grupo": "gancho",
   "nome": "Gancho manuscrito anotado",
   "oQuePinta": "Bloco manuscrito no canto livre, com palavra marcada em pop e traço desenhado por cima.",
   "camada": "alpha",
   "estado": "candidato",
   "bloqueio": "`HookLettering.tsx:182` (HookCluster) não tem prop nenhuma: texto, posição e timings são literais de UMA peça, e ele toca `staticFile(\"sfx/*.wav\")`, que não existe no pacote (`**/public/*` é ignorado). Precisa receber texto, posição e timings por prop, e o SFX por opção, antes de virar `pronto`.",
   "perfis": [
    "reels"
   ],
   "defaultDe": [],
   "origem": "src/HookLettering.tsx:182",
   "parametros": [],
   "duplicatas": [],
   "preview": {
    "durS": 3,
    "placa": "retrato",
    "frameCartao": 54,
    "w": 360,
    "h": 640,
    "fps": 30
   },
   "desde": "2026-08-08",
   "sha": "fe5793c7cb45"
  },
  {
   "slug": "legenda-destaque-tema",
   "grupo": "legenda",
   "nome": "Branca com destaque do tema",
   "oQuePinta": "Legenda branca grande com a palavra ativa na cor de destaque do tema escolhido.",
   "camada": "alpha",
   "estado": "pronto",
   "perfis": [
    "reels",
    "longform"
   ],